{
  "required": true,
  "paper": "white",
  "finish": "matte",
  "direction": "Vivid full-colour gift cover: Alex enthusiastically explains his run at a café table as Sam tries to have a normal conversation. Editorial ink identity from locked references; title dominates at thumbnail size. No logos, app screens or lettering in generated art. Deep blue wrap, vivid coral and yellow accents; spine remains unlettered at 80 pages.",
  "author": "Kieran Smith",
  "back_copy": "They only asked how your weekend was.\n\nYou explained the porridge, the weather, the headwind and why the final average was misleading.\n\nThe Normal Conversation Rehabilitation Service has prepared this manual for runners whose training now occupies meals, holidays and the first twelve minutes of any conversation.\n\nIncludes diagnostic tests, conversation exercises and a certificate of conditional discharge.\n\nGive it to the runner who already knows who they are.",
  "artwork_width_in": 3.4,
  "artwork_height_in": 5.1,
  "drafts": [
    {
      "revision": "v1",
      "path": "cover/drafts/cover-v1.pdf",
      "sha256": "93b1415a5720517fb0ca1f5b9c70247552b29759adc720ce26f102758e6b86fd",
      "artwork_sha256": "e4a88d3405918b92edc7c2ef260547f45c66b8864c5f6d7103870a76bd7dc2d5",
      "status": "draft",
      "submitted_at": "2026-09-20T09:35:50Z",
      "dimensions": {
        "page_count": 80,
        "paper": "white",
        "spine_in": 0.18016,
        "width_in": 12.43016,
        "height_in": 9.25,
        "trim_width_in": 6.0,
        "trim_height_in": 9.0,
        "bleed_in": 0.125
      }
    }
  ],
  "approved": null,
  "preflight": null,
  "preview_interior": {
    "path": "releases/interior-v3-publication-draft.pdf",
    "sha256": "675ff470d239e292e0f7f6433f7ae24a9d94cab234bec5399c695e33ca942d63",
    "status": "provisional_for_cover_review_only"
  }
}
